<?xml version="1.0" encoding="UTF-8"?>

<receta xmlns:xsi="http://www.w3.org/2001/XMLSchema-instance"
    xsi:noNamespaceSchemaLocation="receta.xsd">

    <medicamento>Omeprazol</medicamento>
    <medicamento>Paracetamol</medicamento>

    <farmacia>Farmacia Juaneda</farmacia>

    <edad>70</edad>

    <nombre>Francisco Santos</nombre>

    <pago>Gratuito</pago>

    <precio>2.89</precio>
    
</receta>
